tool,command,description,category,use_case,flags,os,reference_link,supported_languages
strace,strace -f ./binary,Trace system calls with child processes.,Reverse Engineering,System call tracing,"[""-f""]",Linux,https://www.man7.org/linux/man-pages/man1/strace.1.html,
strace,strace -e open ./binary,Trace only open system calls.,Reverse Engineering,System call tracing,"[""-e""]",Linux,https://www.man7.org/linux/man-pages/man1/strace.1.html,
readelf,readelf -s binary.elf,Display symbol table entries of an ELF binary.,Reverse Engineering,Symbol analysis,"[""-s""]",Linux,https://www.man7.org/linux/man-pages/man1/readelf.1.html,
readelf,readelf -r binary.elf,Display relocation entries of an ELF binary.,Reverse Engineering,Relocation analysis,"[""-r""]",Linux,https://www.man7.org/linux/man-pages/man1/readelf.1.html,
gdb,gdb --batch -x commands.gdb ./binary,Run GDB in batch mode with a command file.,Reverse Engineering,Automated debugging,"[""--batch"",""-x""]",Linux,https://www.gnu.org/software/gdb/documentation/,
gdb,gdb -p 1234,Attach GDB to a running process by PID.,Reverse Engineering,Process debugging,"[""-p""]",Linux,https://www.gnu.org/software/gdb/documentation/,
radare2,r2 -c 'aaa' ./binary,Run analysis commands in Radare2 non-interactively.,Reverse Engineering,Automated binary analysis,"[""-c""]",Linux,https://rada.re/r/,
radare2,r2 -i script.r2 ./binary,Execute a Radare2 script for analysis.,Reverse Engineering,Scripted analysis,"[""-i""]",Linux,https://rada.re/r/,
binwalk,binwalk -B firmware.bin,Extract binary blobs from firmware.,Reverse Engineering,Firmware analysis,"[""-B""]",Linux,https://github.com/ReFirmLabs/binwalk,
binwalk,binwalk -I firmware.bin,Identify and extract instruction sets from firmware.,Reverse Engineering,Firmware analysis,"[""-I""]",Linux,https://github.com/ReFirmLabs/binwalk,
ghidra,ghidra -analyzeHeadless ./project binary.elf,Run Ghidra in headless mode for analysis.,Reverse Engineering,Automated binary analysis,"[""-analyzeHeadless""]",Linux,https://ghidra-sre.org/,
ghidra,ghidra -delete project,Delete a Ghidra project.,Reverse Engineering,Project management,"[""-delete""]",Linux,https://ghidra-sre.org/,
objdump,objdump -h binary.elf,Display section headers of a binary.,Reverse Engineering,Section analysis,"[""-h""]",Linux,https://www.man7.org/linux/man-pages/man1/objdump.1.html,
objdump,objdump -r binary.elf,Display relocation entries of a binary.,Reverse Engineering,Relocation analysis,"[""-r""]",Linux,https://www.man7.org/linux/man-pages/man1/objdump.1.html,
strings,strings -e s binary,Extract single-byte encoded strings.,Reverse Engineering,String extraction,"[""-e""]",Linux,https://www.man7.org/linux/man-pages/man1/strings.1.html,
strings,strings -tx binary > offsets.txt,Extract strings with their offsets in a file.,Reverse Engineering,String extraction,"[""-tx""]",Linux,https://www.man7.org/linux/man-pages/man1/strings.1.html,
ida-free,ida64 -L log.txt binary.elf,Log IDA Free analysis to a file.,Reverse Engineering,Analysis logging,"[""-L""]",Linux,https://hex-rays.com/ida-free/,
ida-free,ida64 -P binary.elf,Run IDA Free in portable mode.,Reverse Engineering,Portable analysis,"[""-P""]",Linux,https://hex-rays.com/ida-free/,
ltrace,ltrace -c ./binary,Count library calls made by a binary.,Reverse Engineering,Library call tracing,"[""-c""]",Linux,https://www.man7.org/linux/man-pages/man1/ltrace.1.html,
ltrace,ltrace -i ./binary,Trace library calls with instruction pointers.,Reverse Engineering,Library call tracing,"[""-i""]",Linux,https://www.man7.org/linux/man-pages/man1/ltrace.1.html,
strace,strace -t ./binary,Trace system calls with timestamps.,Reverse Engineering,System call tracing,"[""-t""]",Linux,https://www.man7.org/linux/man-pages/man1/strace.1.html,
strace,strace -p 1234,Attach strace to a running process by PID.,Reverse Engineering,Process tracing,"[""-p""]",Linux,https://www.man7.org/linux/man-pages/man1/strace.1.html,
readelf,readelf -d binary.elf,Display dynamic section of an ELF binary.,Reverse Engineering,Dynamic analysis,"[""-d""]",Linux,https://www.man7.org/linux/man-pages/man1/readelf.1.html,
readelf,readelf -n binary.elf,Display notes section of an ELF binary.,Reverse Engineering,Notes analysis,"[""-n""]",Linux,https://www.man7.org/linux/man-pages/man1/readelf.1.html,
gdb,gdb --eval-command='break main' ./binary,Set a breakpoint at main in GDB.,Reverse Engineering,Binary debugging,"[""--eval-command""]",Linux,https://www.gnu.org/software/gdb/documentation/,
gdb,gdb --eval-command='run' ./binary,Run a binary in GDB automatically.,Reverse Engineering,Binary debugging,"[""--eval-command""]",Linux,https://www.gnu.org/software/gdb/documentation/,
radare2,r2 -e asm.syntax=intel ./binary,Use Intel syntax for disassembly in Radare2.,Reverse Engineering,Binary disassembly,"[""-e""]",Linux,https://rada.re/r/,
radare2,r2 -c 'pdf @ main' ./binary,Disassemble the main function in Radare2.,Reverse Engineering,Function disassembly,"[""-c""]",Linux,https://rada.re/r/,
binwalk,binwalk -A firmware.bin,Analyze firmware for architecture-specific code.,Reverse Engineering,Firmware analysis,"[""-A""]",Linux,https://github.com/ReFirmLabs/binwalk,
binwalk,binwalk -D firmware.bin,Extract data segments from firmware.,Reverse Engineering,Firmware analysis,"[""-D""]",Linux,https://github.com/ReFirmLabs/binwalk,
ghidra,ghidra -scriptPath scripts/,Set a custom script path for Ghidra analysis.,Reverse Engineering,Scripted analysis,"[""-scriptPath""]",Linux,https://ghidra-sre.org/,
ghidra,ghidra -noanalysis binary.elf,Import a binary without automatic analysis.,Reverse Engineering,Manual binary analysis,"[""-noanalysis""]",Linux,https://ghidra-sre.org/,
objdump,objdump -D binary.elf,Disassemble all sections of a binary.,Reverse Engineering,Comprehensive disassembly,"[""-D""]",Linux,https://www.man7.org/linux/man-pages/man1/objdump.1.html,
objdump,objdump -j .text binary.elf,Disassemble only the .text section.,Reverse Engineering,Section disassembly,"[""-j""]",Linux,https://www.man7.org/linux/man-pages/man1/objdump.1.html,
strings,strings -d binary,Extract strings from data sections only.,Reverse Engineering,String extraction,"[""-d""]",Linux,https://www.man7.org/linux/man-pages/man1/strings.1.html,
strings,strings -e l binary,Extract little-endian encoded strings.,Reverse Engineering,String extraction,"[""-e""]",Linux,https://www.man7.org/linux/man-pages/man1/strings.1.html,
ida-free,ida64 -T ELF binary.elf,Specify ELF file type for IDA Free analysis.,Reverse Engineering,Binary analysis,"[""-T""]",Linux,https://hex-rays.com/ida-free/,
ida-free,ida64 -C binary.elf,Run IDA Free with a clean database.,Reverse Engineering,Clean analysis,"[""-C""]",Linux,https://hex-rays.com/ida-free/,
ltrace,ltrace -e malloc ./binary,Trace only malloc library calls.,Reverse Engineering,Library call tracing,"[""-e""]",Linux,https://www.man7.org/linux/man-pages/man1/ltrace.1.html,
ltrace,ltrace -p 1234,Attach ltrace to a running process by PID.,Reverse Engineering,Process tracing,"[""-p""]",Linux,https://www.man7.org/linux/man-pages/man1/ltrace.1.html,
strace,strace -c ./binary,Count system calls made by a binary.,Reverse Engineering,System call tracing,"[""-c""]",Linux,https://www.man7.org/linux/man-pages/man1/strace.1.html,
strace,strace -e signal ./binary,Trace only signal-related system calls.,Reverse Engineering,System call tracing,"[""-e""]",Linux,https://www.man7.org/linux/man-pages/man1/strace.1.html,
readelf,readelf -l binary.elf,Display program headers of an ELF binary.,Reverse Engineering,Program header analysis,"[""-l""]",Linux,https://www.man7.org/linux/man-pages/man1/readelf.1.html,
readelf,readelf -W binary.elf,Display wide output for ELF analysis.,Reverse Engineering,ELF analysis,"[""-W""]",Linux,https://www.man7.org/linux/man-pages/man1/readelf.1.html,
gdb,gdb --tui ./binary,Launch GDB with Text User Interface.,Reverse Engineering,Binary debugging,"[""--tui""]",Linux,https://www.gnu.org/software/gdb/documentation/,
gdb,gdb --write ./binary,Allow GDB to modify the binary.,Reverse Engineering,Binary patching,"[""--write""]",Linux,https://www.gnu.org/software/gdb/documentation/,
radare2,r2 -c 'v' ./binary,Enter visual mode in Radare2.,Reverse Engineering,Visual binary analysis,"[""-c""]",Linux,https://rada.re/r/,
radare2,r2 -c 's main' ./binary,Seek to the main function in Radare2.,Reverse Engineering,Function analysis,"[""-c""]",Linux,https://rada.re/r/,
binwalk,binwalk -R firmware.bin,Perform raw entropy analysis on firmware.,Reverse Engineering,Firmware analysis,"[""-R""]",Linux,https://github.com/ReFirmLabs/binwalk,
binwalk,binwalk -E firmware.bin,Generate entropy graphs for firmware.,Reverse Engineering,Firmware analysis,"[""-E""]",Linux,https://github.com/ReFirmLabs/binwalk,
ghidra,ghidra -processor x86_64,Specify x86_64 processor for Ghidra analysis.,Reverse Engineering,Processor-specific analysis,"[""-processor""]",Linux,https://ghidra-sre.org/,
ghidra,ghidra -max-cpu 4,Limit Ghidra to 4 CPU cores for analysis.,Reverse Engineering,Resource management,"[""-max-cpu""]",Linux,https://ghidra-sre.org/,
wireshark,wireshark,Launch Wireshark for network packet analysis.,Sniffing and Spoofing,Packet capturing,[],Linux,https://www.wireshark.org/docs/,
wireshark,wireshark -i eth0,Capture packets on eth0 interface with Wireshark.,Sniffing and Spoofing,Interface-specific packet capturing,"[""-i""]",Linux,https://www.wireshark.org/docs/,
tcpdump,tcpdump -i eth0,Capture packets on eth0 interface.,Sniffing and Spoofing,Packet capturing,"[""-i""]",Linux,https://www.tcpdump.org/manpages/tcpdump.1.html,
tcpdump,tcpdump -i eth0 -w capture.pcap,Save captured packets to a pcap file.,Sniffing and Spoofing,Packet capturing,"[""-i"",""-w""]",Linux,https://www.tcpdump.org/manpages/tcpdump.1.html,
tcpdump,tcpdump -r capture.pcap,Read and analyze packets from a pcap file.,Sniffing and Spoofing,Packet analysis,"[""-r""]",Linux,https://www.tcpdump.org/manpages/tcpdump.1.html,
ettercap,ettercap -T -i eth0,Launch Ettercap in text mode for sniffing on eth0.,Sniffing and Spoofing,Network sniffing,"[""-T"",""-i""]",Linux,https://www.ettercap-project.org/documentation.html,
ettercap,ettercap -T -M arp /192.168.1.1/ /192.168.1.100/,Perform ARP poisoning between two hosts.,Sniffing and Spoofing,ARP spoofing,"[""-T"",""-M""]",Linux,https://www.ettercap-project.org/documentation.html,
ettercap,ettercap -T -P dns_spoof /192.168.1.0/24/,Perform DNS spoofing on a network.,Sniffing and Spoofing,DNS spoofing,"[""-T"",""-P""]",Linux,https://www.ettercap-project.org/documentation.html,
arpspoof,arpspoof -i eth0 -t 192.168.1.100 192.168.1.1,Spoof ARP packets to poison a target.,Sniffing and Spoofing,ARP spoofing,"[""-i"",""-t""]",Linux,https://www.kali.org/tools/dsniff/,
arpspoof,arpspoof -i eth0 -t 192.168.1.1 192.168.1.100,Spoof ARP packets for bidirectional poisoning.,Sniffing and Spoofing,ARP spoofing,"[""-i"",""-t""]",Linux,https://www.kali.org/tools/dsniff/,
dnsspoof,dnsspoof -i eth0 -f hosts.txt,Spoof DNS responses using a hosts file.,Sniffing and Spoofing,DNS spoofing,"[""-i"",""-f""]",Linux,https://www.kali.org/tools/dsniff/,
dnsspoof,dnsspoof -i eth0 host 192.168.1.100,Spoof DNS for a specific host.,Sniffing and Spoofing,DNS spoofing,"[""-i"",""host""]",Linux,https://www.kali.org/tools/dsniff/,
macchanger,macchanger -r eth0,Randomize the MAC address of eth0.,Sniffing and Spoofing,MAC spoofing,"[""-r""]",Linux,https://www.kali.org/tools/macchanger/,
macchanger,macchanger -m 00:11:22:33:44:55 eth0,Set a specific MAC address for eth0.,Sniffing and Spoofing,MAC spoofing,"[""-m""]",Linux,https://www.kali.org/tools/macchanger/,
tshark,tshark -i eth0,Capture packets on eth0 using Tshark.,Sniffing and Spoofing,Packet capturing,"[""-i""]",Linux,https://www.wireshark.org/docs/man-pages/tshark.html,
tshark,tshark -r capture.pcap,Analyze packets from a pcap file.,Sniffing and Spoofing,Packet analysis,"[""-r""]",Linux,https://www.wireshark.org/docs/man-pages/tshark.html,
tshark,tshark -i eth0 -w output.pcap,Save captured packets to a pcap file.,Sniffing and Spoofing,Packet capturing,"[""-i"",""-w""]",Linux,https://www.wireshark.org/docs/man-pages/tshark.html,
wireshark,wireshark -r capture.pcap,Open a pcap file in Wireshark for analysis.,Sniffing and Spoofing,Packet analysis,"[""-r""]",Linux,https://www.wireshark.org/docs/,
wireshark,wireshark -f 'tcp port 80' -i eth0,Capture HTTP traffic on eth0.,Sniffing and Spoofing,Protocol-specific capturing,"[""-f"",""-i""]",Linux,https://www.wireshark.org/docs/,
tcpdump,tcpdump -i eth0 port 80,Capture HTTP traffic on eth0.,Sniffing and Spoofing,Protocol-specific capturing,"[""-i"",""port""]",Linux,https://www.tcpdump.org/manpages/tcpdump.1.html,
tcpdump,tcpdump -i eth0 -c 100,Capture 100 packets on eth0.,Sniffing and Spoofing,Limited packet capturing,"[""-i"",""-c""]",Linux,https://www.tcpdump.org/manpages/tcpdump.1.html,
ettercap,ettercap -T -M dhcp:192.168.1.100/192.168.1.1/,Perform DHCP spoofing on a network.,Sniffing and Spoofing,DHCP spoofing,"[""-T"",""-M""]",Linux,https://www.ettercap-project.org/documentation.html,
ettercap,ettercap -T -P sslstrip /192.168.1.0/24/,Strip SSL from HTTPS traffic for sniffing.,Sniffing and Spoofing,SSL stripping,"[""-T"",""-P""]",Linux,https://www.ettercap-project.org/documentation.html,
arpspoof,arpspoof -i eth0 -t 192.168.1.100,Spoof ARP packets targeting a specific host.,Sniffing and Spoofing,ARP spoofing,"[""-i"",""-t""]",Linux,https://www.kali.org/tools/dsniff/,
dnsspoof,dnsspoof -i eth0 udp port 53,Spoof DNS responses on UDP port 53.,Sniffing and Spoofing,DNS spoofing,"[""-i"",""udp"",""port""]",Linux,https://www.kali.org/tools/dsniff/,
macchanger,macchanger -s eth0,Show the current MAC address of eth0.,Sniffing and Spoofing,MAC address inspection,"[""-s""]",Linux,https://www.kali.org/tools/macchanger/,
macchanger,macchanger -b eth0,Set a burned-in MAC address for eth0.,Sniffing and Spoofing,MAC spoofing,"[""-b""]",Linux,https://www.kali.org/tools/macchanger/,
tshark,tshark -i eth0 -f 'port 443',Capture HTTPS traffic on eth0.,Sniffing and Spoofing,Protocol-specific capturing,"[""-i"",""-f""]",Linux,https://www.wireshark.org/docs/man-pages/tshark.html,
tshark,tshark -i eth0 -T fields -e ip.src,Extract source IP addresses from captured packets.,Sniffing and Spoofing,Packet field extraction,"[""-i"",""-T"",""-e""]",Linux,https://www.wireshark.org/docs/man-pages/tshark.html,
wireshark,wireshark -Y 'http' -r capture.pcap,Filter HTTP packets in a pcap file.,Sniffing and Spoofing,Packet filtering,"[""-Y"",""-r""]",Linux,https://www.wireshark.org/docs/,
tcpdump,tcpdump -i eth0 host 192.168.1.100,Capture packets to/from a specific host.,Sniffing and Spoofing,Host-specific capturing,"[""-i"",""host""]",Linux,https://www.tcpdump.org/manpages/tcpdump.1.html,
tcpdump,tcpdump -i eth0 -vv,Capture packets with verbose output.,Sniffing and Spoofing,Detailed packet capturing,"[""-i"",""-vv""]",Linux,https://www.tcpdump.org/manpages/tcpdump.1.html,
ettercap,ettercap -T -u -i eth0,Sniff unified packets on eth0.,Sniffing and Spoofing,Unified sniffing,"[""-T"",""-u"",""-i""]",Linux,https://www.ettercap-project.org/documentation.html,
ettercap,ettercap -T -P mac_flood /192.168.1.0/24/,Perform MAC flooding to overwhelm switches.,Sniffing and Spoofing,MAC flooding,"[""-T"",""-P""]",Linux,https://www.ettercap-project.org/documentation.html,
arpspoof,arpspoof -i eth0 -r -t 192.168.1.100,Spoof ARP packets with reverse poisoning.,Sniffing and Spoofing,ARP spoofing,"[""-i"",""-r"",""-t""]",Linux,https://www.kali.org/tools/dsniff/,
dnsspoof,dnsspoof -i eth0 -v,Spoof DNS responses with verbose output.,Sniffing and Spoofing,DNS spoofing,"[""-i"",""-v""]",Linux,https://www.kali.org/tools/dsniff/,
macchanger,macchanger -e eth0,Set a MAC address similar to the original.,Sniffing and Spoofing,MAC spoofing,"[""-e""]",Linux,https://www.kali.org/tools/macchanger/,
tshark,tshark -i eth0 -c 100,Capture 100 packets on eth0.,Sniffing and Spoofing,Limited packet capturing,"[""-i"",""-c""]",Linux,https://www.wireshark.org/docs/man-pages/tshark.html,
wireshark,wireshark -i eth0 -k,Start capturing packets immediately on eth0.,Sniffing and Spoofing,Immediate packet capturing,"[""-i"",""-k""]",Linux,https://www.wireshark.org/docs/,
tcpdump,tcpdump -i eth0 -n,Capture packets without DNS resolution.,Sniffing and Spoofing,Packet capturing,"[""-i"",""-n""]",Linux,https://www.tcpdump.org/manpages/tcpdump.1.html,
ettercap,ettercap -T -P arp_storm /192.168.1.0/24/,Generate an ARP storm on the network.,Sniffing and Spoofing,ARP storming,"[""-T"",""-P""]",Linux,https://www.ettercap-project.org/documentation.html,
ettercap,ettercap -T -M port /192.168.1.100/ /192.168.1.1/,Perform port stealing for sniffing.,Sniffing and Spoofing,Port stealing,"[""-T"",""-M""]",Linux,https://www.ettercap-project.org/documentation.html,
arpspoof,arpspoof -i eth0 -t 192.168.1.100 -h 00:11:22:33:44:55,Spoof ARP packets with a specific MAC address.,Sniffing and Spoofing,ARP spoofing,"[""-i"",""-t"",""-h""]",Linux,https://www.kali.org/tools/dsniff/,
dnsspoof,dnsspoof -i eth0 -d,Spoof DNS responses with debugging output.,Sniffing and Spoofing,DNS spoofing,"[""-i"",""-d""]",Linux,https://www.kali.org/tools/dsniff/,
macchanger,macchanger -l,List known MAC address vendors.,Sniffing and Spoofing,MAC address reconnaissance,"[""-l""]",Linux,https://www.kali.org/tools/macchanger/,
tshark,"tshark -i eth0 -z io,stat,1",Display packet statistics every second.,Sniffing and Spoofing,Traffic statistics,"[""-i"",""-z""]",Linux,https://www.wireshark.org/docs/man-pages/tshark.html,
wireshark,"wireshark -z io,stat,1 -i eth0",Display real-time packet statistics.,Sniffing and Spoofing,Traffic statistics,"[""-z"",""-i""]",Linux,https://www.wireshark.org/docs/,
tcpdump,tcpdump -i eth0 -s 1500,Capture packets with a snaplen of 1500 bytes.,Sniffing and Spoofing,Packet capturing,"[""-i"",""-s""]",Linux,https://www.tcpdump.org/manpages/tcpdump.1.html,
ettercap,ettercap -T -P icmp_redirect /192.168.1.0/24/,Perform ICMP redirect spoofing.,Sniffing and Spoofing,ICMP spoofing,"[""-T"",""-P""]",Linux,https://www.ettercap-project.org/documentation.html,
tshark,tshark -i eth0 -Y 'http.request',Filter and display HTTP requests.,Sniffing and Spoofing,Packet filtering,"[""-i"",""-Y""]",Linux,https://www.wireshark.org/docs/man-pages/tshark.html,
nmap,nmap 192.168.1.0/24,Scan a network range for live hosts.,Information Gathering,Network scanning,[],Linux,https://nmap.org/book/man.html,
theHarvester,theharvester -d example.com -b google,Harvest emails and subdomains from Google.,Information Gathering,OSINT email harvesting,"[""-d"",""-b""]",Linux,https://github.com/laramies/theHarvester,
maltego,maltego,Launch Maltego for OSINT and relationship mapping.,Information Gathering,OSINT analysis,[],Linux,https://www.maltego.com/,
dnsenum,dnsenum example.com,Enumerate DNS records for a domain.,Information Gathering,DNS enumeration,[],Linux,https://github.com/fwaeytens/dnsenum,
whois,whois example.com,Retrieve WHOIS information for a domain.,Information Gathering,Domain reconnaissance,[],Linux,https://www.man7.org/linux/man-pages/man1/whois.1.html,
shodan,"shodan search --fields ip_str,port,org 'os:linux'",Search for Linux-based devices on Shodan.,Information Gathering,Internet-exposed device search,"[""search"",""--fields""]",Linux,https://cli.shodan.io/,
recon-ng,recon-ng,Launch Recon-ng for reconnaissance tasks.,Information Gathering,Reconnaissance framework,[],Linux,https://github.com/lanmaster53/recon-ng,
metagoofil,"metagoofil -d example.com -t doc,pdf -o output.html",Extract metadata from documents on a domain.,Information Gathering,Metadata extraction,"[""-d"",""-t"",""-o""]",Linux,https://github.com/laramies/metagoofil,
amass,amass enum -d example.com,Enumerate subdomains for a target domain.,Information Gathering,Subdomain enumeration,"[""enum"",""-d""]",Linux,https://github.com/OWASP/Amass,
sublist3r,sublist3r -d example.com,Enumerate subdomains using multiple sources.,Information Gathering,Subdomain enumeration,"[""-d""]",Linux,https://github.com/aboul3la/Sublist3r,
dnsrecon,dnsrecon -d example.com,Perform DNS reconnaissance on a domain.,Information Gathering,DNS reconnaissance,"[""-d""]",Linux,https://github.com/darkoperator/dnsrecon,
fierce,fierce --domain example.com,Enumerate subdomains and DNS records.,Information Gathering,DNS enumeration,"[""--domain""]",Linux,https://github.com/mschwager/fierce,
dmitry,dmitry -i example.com,Gather WHOIS and host information.,Information Gathering,Domain reconnaissance,"[""-i""]",Linux,https://www.kali.org/tools/dmitry/,
netdiscover,netdiscover -i eth0,Discover active hosts on a network.,Information Gathering,Network discovery,"[""-i""]",Linux,https://github.com/netdiscover-scanner/netdiscover,
enum4linux,enum4linux 192.168.1.100,Enumerate SMB shares and users on a target.,Information Gathering,SMB enumeration,[],Linux,https://github.com/CiscoCXSecurity/enum4linux,
onesixtyone,onesixtyone 192.168.1.100,Enumerate SNMP information from a target.,Information Gathering,SNMP enumeration,[],Linux,https://github.com/trailofbits/onesixtyone,
nikto,nikto -h http://example.com,Scan web server for misconfigurations.,Information Gathering,Web server reconnaissance,"[""-h""]",Linux,https://cirt.net/Nikto2,
whatweb,whatweb example.com,Identify technologies used by a website.,Information Gathering,Web reconnaissance,[],Linux,https://www.morningstarsecurity.com/research/whatweb,
wafw00f,wafw00f example.com,Detect web application firewalls.,Information Gathering,WAF detection,[],Linux,https://github.com/EnableSecurity/wafw00f,
snmp-check,snmp-check 192.168.1.100,Enumerate SNMP data from a target.,Information Gathering,SNMP enumeration,[],Linux,https://www.kali.org/tools/snmpcheck/,
sparta,sparta,Launch SPARTA for network reconnaissance.,Information Gathering,Network scanning,[],Linux,https://www.kali.org/tools/sparta/,
masscan,"masscan 192.168.1.0/24 -p80,443",Scan network for open ports 80 and 443.,Information Gathering,Port scanning,"[""-p""]",Linux,https://github.com/robertdavidgraham/masscan,
unicornscan,unicornscan 192.168.1.100 -p 1-65535,Perform a full port scan on a target.,Information Gathering,Port scanning,"[""-p""]",Linux,https://www.kali.org/tools/unicornscan/,
hping3,hping3 -S 192.168.1.100 -p 80,Send SYN packets to port 80 for reconnaissance.,Information Gathering,Packet crafting,"[""-S"",""-p""]",Linux,http://www.hping.org/manpage.html,
nmap,nmap 192.168.1.0/24,Scan a network range for live hosts.,Information Gathering,Network scanning,[],Linux,https://nmap.org/book/man.html,
theHarvester,theharvester -d example.com -b google,Harvest emails and subdomains from Google.,Information Gathering,OSINT email harvesting,"[""-d"",""-b""]",Linux,https://github.com/laramies/theHarvester,
maltego,maltego,Launch Maltego for OSINT and relationship mapping.,Information Gathering,OSINT analysis,[],Linux,https://www.maltego.com/,
dnsenum,dnsenum example.com,Enumerate DNS records for a domain.,Information Gathering,DNS enumeration,[],Linux,https://github.com/fwaeytens/dnsenum,
whois,whois example.com,Retrieve WHOIS information for a domain.,Information Gathering,Domain reconnaissance,[],Linux,https://www.man7.org/linux/man-pages/man1/whois.1.html,
shodan,"shodan search --fields ip_str,port,org 'os:linux'",Search for Linux-based devices on Shodan.,Information Gathering,Internet-exposed device search,"[""search"",""--fields""]",Linux,https://cli.shodan.io/,
recon-ng,recon-ng,Launch Recon-ng for reconnaissance tasks.,Information Gathering,Reconnaissance framework,[],Linux,https://github.com/lanmaster53/recon-ng,
metagoofil,"metagoofil -d example.com -t doc,pdf -o output.html",Extract metadata from documents on a domain.,Information Gathering,Metadata extraction,"[""-d"",""-t"",""-o""]",Linux,https://github.com/laramies/metagoofil,
amass,amass enum -d example.com,Enumerate subdomains for a target domain.,Information Gathering,Subdomain enumeration,"[""enum"",""-d""]",Linux,https://github.com/OWASP/Amass,
sublist3r,sublist3r -d example.com,Enumerate subdomains using multiple sources.,Information Gathering,Subdomain enumeration,"[""-d""]",Linux,https://github.com/aboul3la/Sublist3r,
dnsrecon,dnsrecon -d example.com,Perform DNS reconnaissance on a domain.,Information Gathering,DNS reconnaissance,"[""-d""]",Linux,https://github.com/darkoperator/dnsrecon,
fierce,fierce --domain example.com,Enumerate subdomains and DNS records.,Information Gathering,DNS enumeration,"[""--domain""]",Linux,https://github.com/mschwager/fierce,
dmitry,dmitry -i example.com,Gather WHOIS and host information.,Information Gathering,Domain reconnaissance,"[""-i""]",Linux,https://www.kali.org/tools/dmitry/,
netdiscover,netdiscover -i eth0,Discover active hosts on a network.,Information Gathering,Network discovery,"[""-i""]",Linux,https://github.com/netdiscover-scanner/netdiscover,
enum4linux,enum4linux 192.168.1.100,Enumerate SMB shares and users on a target.,Information Gathering,SMB enumeration,[],Linux,https://github.com/CiscoCXSecurity/enum4linux,
onesixtyone,onesixtyone 192.168.1.100,Enumerate SNMP information from a target.,Information Gathering,SNMP enumeration,[],Linux,https://github.com/trailofbits/onesixtyone,
nikto,nikto -h http://example.com,Scan web server for misconfigurations.,Information Gathering,Web server reconnaissance,"[""-h""]",Linux,https://cirt.net/Nikto2,
whatweb,whatweb example.com,Identify technologies used by a website.,Information Gathering,Web reconnaissance,[],Linux,https://www.morningstarsecurity.com/research/whatweb,
wafw00f,wafw00f example.com,Detect web application firewalls.,Information Gathering,WAF detection,[],Linux,https://github.com/EnableSecurity/wafw00f,
snmp-check,snmp-check 192.168.1.100,Enumerate SNMP data from a target.,Information Gathering,SNMP enumeration,[],Linux,https://www.kali.org/tools/snmpcheck/,
